[
{
"date": "05-02-16",
"time": " 14:28:07",
"user": " אלון דוד",
"content": " קיבלתי בציון של תנ"
},
{
"date": "05-02-16",
"time": " 14:28:11",
"user": " אלון דוד",
"content": " ����������"
},
{
"date": "05-02-16",
"time": " 14:32:13",
"user": " שרית קרויטורו",
"content": " כל הכבוד!!��������"
},
{
"date": "05-02-16",
"time": " 14:34:41",
"user": " Raya",
"content": " ✔������"
},
{
"date": "05-02-16",
"time": " 16:41:41",
"user": " Sweet Hila Croitoru",
"content": " קיבלתי במדעים 100"
},
{
"date": "05-02-16",
"time": " 16:42:42",
"user": " פרידה",
"content": " כל הכבוד ����������"
},
{
"date": "05-02-16",
"time": " 16:43:43",
"user": " שרית קרויטורו",
"content": " כל הכבוד!!��������"
},
{
"date": "05-03-16",
"time": " 9:02:52",
"user": " צביקה",
"content": " רעיה מה אמרו בגן על הסנדלים"
},
{
"date": "05-03-16",
"time": " 11:41:14",
"user": " Raya",
"content": " אהבו"
},
{
"date": "05-04-16",
"time": " 7:53:18",
"user": " צביקה",
"content": " מזל טוב ובהצלחה לכפיר. היום שיעור נהיגה ראשון ��"
},
{
"date": "05-04-16",
"time": " 7:55:01",
"user": " Zalman",
"content": " מזל טוב ובהצלחה."
},
{
"date": "05-04-16",
"time": " 7:55:35",
"user": " אלון דוד",
"content": " בהצלחה"
},
{
"date": "05-04-16",
"time": " 8:00:36",
"user": " פרידה",
"content": " מזל טוב והצלחה. זהירות ובטיחות ����"
},
{
"date": "05-04-16",
"time": " 8:34:05",
"user": " Raya",
"content": " בהצלחה"
},
{
"date": "05-04-16",
"time": " 9:30:29",
"user": " דוד ירון",
"content": " בהצלחה ������"
},
{
"date": "05-04-16",
"time": " 12:09:02",
"user": " דני ק",
"content": " בהצלחה ובזהירות"
},
{
"date": "05-04-16",
"time": " 15:29:49",
"user": " Sweet Hila Croitoru",
"content": " בהצלחה!!!!!❣❣❣"
},
{
"date": "05-05-16",
"time": " 7:27:54",
"user": " אלון דוד",
"content": " מזל טוב לאמא������!!! "
},
{
"date": "05-05-16",
"time": " 7:28:30",
"user": " דוד ירון",
"content": " מזל טוב לאישתי היקרה������������������"
},
{
"date": "05-05-16",
"time": " 7:29:30",
"user": " Sweet Hila Croitoru",
"content": " מזל טוב פרידה!!!!❣❤����������������������������������"
},
{
"date": "05-05-16",
"time": " 7:31:49",
"user": " רותם קרויטורו",
"content": " מזל טוב פרידה������❣"
},
{
"date": "05-05-16",
"time": " 7:48:01",
"user": " פרידה",
"content": " תודה חמודות. יום טוב ��"
},
{
"date": "05-05-16",
"time": " 7:48:42",
"user": " רותם קרויטורו",
"content": " יום טוב"
},
{
"date": "05-05-16",
"time": " 7:58:12",
"user": " Raya",
"content": " מזל טוב פרידה שפע של ברכות ����������וים איחולים ��������מכל ה❤❤"
},
{
"date": "05-05-16",
"time": " 8:20:21",
"user": " שרית קרויטורו",
"content": " פרידה מזל -טוב!! "
},
{
"date": "05-05-16",
"time": " 8:38:08",
"user": " דני ק",
"content": " מזל טוב. המון בריאות"
},
{
"date": "05-05-16",
"time": " 9:15:09",
"user": " צביקה",
"content": " ����������❤❤��������������������������"
},
{
"date": "05-05-16",
"time": " 9:17:15",
"user": " פרידה",
"content": " תודה לכולם על הברכות היפות וגם על האימוג'ים �� ��"
},
{
"date": "05-05-16",
"time": " 9:24:53",
"user": " דוד ירון",
"content": " אמא שלי מנסה להתקשר אלייך"
},
{
"date": "05-06-16",
"time": " 14:04:37",
"user": " פרידה",
"content": " מישהו מהחמודים בדרך?"
},
{
"date": "05-06-16",
"time": " 14:05:43",
"user": " Raya",
"content": " אנחנו באוטו"
},
{
"date": "05-06-16",
"time": " 14:08:51",
"user": " Raya",
"content": " "
},
{
"date": "05-06-16",
"time": " 14:17:29",
"user": " שרית קרויטורו",
"content": " אנחנו יצאנו לדרך"
},
{
"date": "05-06-16",
"time": " 14:47:03",
"user": " פרידה",
"content": " החניה שלנו פנויה. כל הקודם זוכה"
},
{
"date": "05-06-16",
"time": " 14:47:31",
"user": " פרידה",
"content": " תבדקו עם ההורים מי מביא אותם."
},
{
"date": "05-06-16",
"time": " 14:47:40",
"user": " פרידה",
"content": " גם אנחנו אופציה"
},
{
"date": "05-06-16",
"time": " 15:06:55",
"user": " Raya",
"content": " למי שעוד לא קרא ! אני כתבתי -למרות שכתוב מערכת ״את״ "
},
{
"date": "05-07-16",
"time": " 14:48:16",
"user": " רותם קרויטורו",
"content": " 2016-05-07-PHOTO-00004464.jpg <‏מצורף>"
	},
	{
		"date": "05-07-16",
		"time": " 14:48:36",
		"user": " רותם קרויטורו",
		"content": " 2016-05-07-PHOTO-00004465.jpg <‏מצורף>"
	},
	{
		"date": "05-07-16",
		"time": " 16:03:09",
		"user": " שרית קרויטורו",
		"content": " 2016-05-07-PHOTO-00004466.jpg <‏מצורף>"
	},
	{
		"date": "05-07-16",
		"time": " 16:03:09",
		"user": " שרית קרויטורו",
		"content": " 2016-05-07-PHOTO-00004467.jpg <‏מצורף>"
	},
	{
		"date": "05-07-16",
		"time": " 16:04:47",
		"user": " צביקה",
		"content": " 2016-05-07-PHOTO-00004468.jpg <‏מצורף>"
	},
	{
		"date": "05-07-16",
		"time": " 16:28:34",
		"user": " פרידה",
		"content": " בתיאבון. איזה כיף. איפה אתם?"
	},
	{
		"date": "05-07-16",
		"time": " 16:30:35",
		"user": " רותם קרויטורו",
		"content": " אודים"
	},
	{
		"date": "05-09-16",
		"time": " 10:14:20",
		"user": " פרידה",
		"content": " דיברתי עם משאבים. להלן פרטים:"
	},
	{
		"date": "05-09-16",
		"time": " 10:17:28",
		"user": " דוד ירון",
		"content": " נשמע טוב"
	},
	{
		"date": "05-09-16",
		"time": " 10:17:40",
		"user": " פרידה",
		"content": " ����"
	},
	{
		"date": "05-09-16",
		"time": " 10:20:07",
		"user": " שרית קרויטורו",
		"content": " בוקר�� אז האם תרצו להתארגן שנקנה ביחד בשרים/שתייה?"
	},
	{
		"date": "05-09-16",
		"time": " 10:37:33",
		"user": " פרידה",
		"content": " אפשר. צריך גם כלים להכנה ולאכילה (ושתיה)"
	},
	{
		"date": "05-09-16",
		"time": " 10:38:52",
		"user": " Raya",
		"content": " אני יכולה לקנות כלים יש לי פה ליד העבודה"
	},
	{
		"date": "05-09-16",
		"time": " 10:39:06",
		"user": " Raya",
		"content": " גם שתיה יכולה לקנות"
	},
	{
		"date": "05-09-16",
		"time": " 10:41:05",
		"user": " פרידה",
		"content": " מעולה צריך לקרר חלק מהשתיה שיהיה ליום הראשון"
	},
	{
		"date": "05-09-16",
		"time": " 10:42:09",
		"user": " פרידה",
		"content": " שרית רוצה לדאוג לירקות/פירות ונשנושים? אני אקנה בשרים."
	},
	{
		"date": "05-09-16",
		"time": " 10:42:39",
		"user": " שרית קרויטורו",
		"content": " כן בשמחה!"
	},
	{
		"date": "05-09-16",
		"time": " 10:43:29",
		"user": " פרידה",
		"content": " יופי. אני אקנה כנראה מחר אם יש בקשות מיוחדות תעבירו היום"
	},
	{
		"date": "05-09-16",
		"time": " 10:43:49",
		"user": " Raya",
		"content": " אקנה גם קערות וכלים להגשה"
	},
	{
		"date": "05-09-16",
		"time": " 10:45:21",
		"user": " פרידה",
		"content": " מפיות"
	},
	{
		"date": "05-09-16",
		"time": " 10:46:17",
		"user": " שרית קרויטורו",
		"content": " אם יש בקשות מיוחדות גם לדברמם שאני קונה תעבירו היום��"
	},
	{
		"date": "05-09-16",
		"time": " 10:46:20",
		"user": " Raya",
		"content": " ברור ! גם מפות"
	},
	{
		"date": "05-09-16",
		"time": " 10:46:37",
		"user": " שרית קרויטורו",
		"content": " פחמים"
	},
	{
		"date": "05-09-16",
		"time": " 10:48:22",
		"user": " Raya",
		"content": " אקנה פחמים"
	},
	{
		"date": "05-09-16",
		"time": " 10:49:07",
		"user": " פרידה",
		"content": " אולי נעשה פורום נפרד של שלושתנו שלא נציק לכולם עם התיאומים? מי יכולה אני לא בטוחה שאני יודעת איך"
	},
	{
		"date": "05-09-16",
		"time": " 11:26:41",
		"user": " צביקה",
		"content": " מה לגבי לו"
	},
	{
		"date": "05-09-16",
		"time": " 11:30:14",
		"user": " פרידה",
		"content": " אתה אחראי ��"
	},
	{
		"date": "05-09-16",
		"time": " 11:30:51",
		"user": " פרידה",
		"content": " אל תשכח את מוזיאון חיל האויר של טרנר..."
	},
	{
		"date": "05-09-16",
		"time": " 11:36:12",
		"user": " דוד ירון",
		"content": " נווה מדבר. ספינת המדבר"
	},
	{
		"date": "05-09-16",
		"time": " 11:36:30",
		"user": " דוד ירון",
		"content": " טיוליי גמלים וברכות רחצה"
	},
	{
		"date": "05-09-16",
		"time": " 14:59:32",
		"user": " דני ק",
		"content": " 2016-05-09-PHOTO-00004494.jpg <‏מצורף>"
	},
	{
		"date": "05-09-16",
		"time": " 15:11:42",
		"user": " דוד ירון",
		"content": " יפה דומה לי"
	},
	{
		"date": "05-09-16",
		"time": " 15:52:53",
		"user": " פרידה",
		"content": " איזה מהם?"
	},
	{
		"date": "05-09-16",
		"time": " 20:47:44",
		"user": " דני ק",
		"content": " 2016-05-09-PHOTO-00004497.jpg <‏מצורף>"
	},
	{
		"date": "05-09-16",
		"time": " 20:51:49",
		"user": " דני ק",
		"content": " נראה לי שנלך על זה"
	},
	{
		"date": "05-10-16",
		"time": " 17:37:26",
		"user": " דני ק",
		"content": " 2016-05-10-PHOTO-00004499.jpg <‏מצורף>"
	},
	{
		"date": "05-11-16",
		"time": " 12:38:34",
		"user": " Sweet Hila Croitoru",
		"content": " תביאו קורקינטים"
	},
	{
		"date": "05-11-16",
		"time": " 13:00:12",
		"user": " פרידה",
		"content": " מה התוכניות? אנחנו מתארגנים לצאת בחצי שעה הקרובה"
	},
	{
		"date": "05-11-16",
		"time": " 13:28:07",
		"user": " צביקה",
		"content": " יופי"
	},
	{
		"date": "05-11-16",
		"time": " 13:38:00",
		"user": " אלון דוד",
		"content": " אנחנו יצאנו לדרך"
	},
	{
		"date": "05-11-16",
		"time": " 13:38:18",
		"user": " אלון דוד",
		"content": " דרך כביש 6"
	},
	{
		"date": "05-11-16",
		"time": " 13:47:57",
		"user": " אלון דוד",
		"content": " איפה נפגשים???"
	},
	{
		"date": "05-11-16",
		"time": " 13:48:02",
		"user": " אלון דוד",
		"content": " אמא שלי שואלת"
	},
	{
		"date": "05-11-16",
		"time": " 13:49:17",
		"user": " דני ק",
		"content": " קצה כביש 6 חפשו תחנת דלק"
	},
	{
		"date": "05-11-16",
		"time": " 13:49:40",
		"user": " אלון דוד",
		"content": " אוקי"
	},
	{
		"date": "05-11-16",
		"time": " 13:49:46",
		"user": " דני ק",
		"content": " ושלחו לנו כיוון. אנחנו נצא ב 14:30. שנגיע יחד"
	},
	{
		"date": "05-11-16",
		"time": " 13:50:07",
		"user": " אלון דוד",
		"content": " אוקי"
	},
	{
		"date": "05-11-16",
		"time": " 13:53:39",
		"user": " צביקה",
		"content": " מה עם אוכל"
	},
	{
		"date": "05-11-16",
		"time": " 13:54:29",
		"user": " דני ק",
		"content": " אכלנו עכשיו    בטח נאכל משהו קל בהמשך. רעיה מביאה ספגטי מוכן למי שרוצה השלמות"
	},
	{
		"date": "05-11-16",
		"time": " 13:56:03",
		"user": " אלון דוד",
		"content": " צביקה איפה אתם אוכלים???"
	},
	{
		"date": "05-11-16",
		"time": " 13:58:38",
		"user": " צביקה",
		"content": " ל4 ידעו"
	},
	{
		"date": "05-11-16",
		"time": " 13:59:38",
		"user": " אלון דוד",
		"content": " מקדונלס פתוח היום?"
	},
	{
		"date": "05-11-16",
		"time": " 14:23:05",
		"user": " דני ק",
		"content": " 2016-05-11-PHOTO-00004517.jpg <‏מצורף>"
	},
	{
		"date": "05-11-16",
		"time": " 14:28:02",
		"user": " אמא",
		"content": " איפה זה?"
	},
	{
		"date": "05-11-16",
		"time": " 14:30:33",
		"user": " דני ק",
		"content": " פארק גבעתיים"
	},
	{
		"date": "05-11-16",
		"time": " 14:40:29",
		"user": " דני ק",
		"content": " איפה אתם?"
	},
	{
		"date": "05-11-16",
		"time": " 14:41:08",
		"user": " אלון דוד",
		"content": " אנחנו במקדונלס כפר יונה"
	},
	{
		"date": "05-11-16",
		"time": " 14:41:11",
		"user": " צביקה",
		"content": " אוכלים"
	},
	{
		"date": "05-11-16",
		"time": " 14:43:32",
		"user": " דני ק",
		"content": " התחלה-אמצע-סוף?"
	},
	{
		"date": "05-11-16",
		"time": " 16:08:23",
		"user": " אלון דוד",
		"content": " דני איפה עוצרים פרישה שואלת"
	},
	{
		"date": "05-11-16",
		"time": " 16:08:28",
		"user": " אלון דוד",
		"content": " פרידה"
	},
	{
		"date": "05-11-16",
		"time": " 17:20:06",
		"user": " דני ק",
		"content": " הגענו למקום"
	},
	{
		"date": "05-11-16",
		"time": " 17:20:32",
		"user": " צביקה",
		"content": " יופי.  עוד 15 גק"
	},
	{
		"date": "05-11-16",
		"time": " 17:20:35",
		"user": " צביקה",
		"content": " דק"
	},
	{
		"date": "05-11-16",
		"time": " 17:21:37",
		"user": " אלון דוד",
		"content": " איך המקום טוב???"
	},
	{
		"date": "05-11-16",
		"time": " 17:21:55",
		"user": " צביקה",
		"content": " רותם?"
	},
	{
		"date": "05-11-16",
		"time": " 17:22:06",
		"user": " דני ק",
		"content": " לא יודע.  רעיה הלכה לקבלה"
	},
	{
		"date": "05-11-16",
		"time": " 17:22:24",
		"user": " רותם קרויטורו",
		"content": " מה"
	},
	{
		"date": "05-11-16",
		"time": " 17:22:36",
		"user": " רותם קרויטורו",
		"content": " '?"
	},
	{
		"date": "05-11-16",
		"time": " 17:22:50",
		"user": " צביקה",
		"content": " התקשרת"
	},
	{
		"date": "05-11-16",
		"time": " 17:23:10",
		"user": " רותם קרויטורו",
		"content": " כן"
	},
	{
		"date": "05-11-16",
		"time": " 17:23:44",
		"user": " צביקה",
		"content": " אפשר לעזור"
	},
	{
		"date": "05-11-16",
		"time": " 17:27:07",
		"user": " דני ק",
		"content": " לקחנו את כל המפתחות.  תבעו אחרי הקבלה עם הכביש עוד 100 מ ותראו את הרכב שלי.  "
	},
	{
		"date": "05-11-16",
		"time": " 17:27:25",
		"user": " דני ק",
		"content": " תסעו"
	},
	{
		"date": "05-11-16",
		"time": " 17:28:23",
		"user": " רותם קרויטורו",
		"content": " דני עצרו"
	},
	{
		"date": "05-11-16",
		"time": " 18:27:14",
		"user": " דוד ירון",
		"content": " <‏התמונה הושמטה>"
	},
	{
		"date": "05-11-16",
		"time": " 18:27:29",
		"user": " דוד ירון",
		"content": " <‏התמונה הושמטה>"
	},
	{
		"date": "05-11-16",
		"time": " 18:27:59",
		"user": " דוד ירון",
		"content": " <‏התמונה הושמטה>"
	},
	{
		"date": "05-11-16",
		"time": " 19:01:44",
		"user": " דוד ירון",
		"content": " <‏התמונה הושמטה>"
	},
	{
		"date": "05-11-16",
		"time": " 19:02:04",
		"user": " דוד ירון",
		"content": " <‏התמונה הושמטה>"
	},
	{
		"date": "05-11-16",
		"time": " 19:46:36",
		"user": " פרידה",
		"content": " <‏התמונה הושמטה>"
	},
	{
		"date": "05-11-16",
		"time": " 19:55:32",
		"user": " אמא",
		"content": " לכולכם חג עצמאות שמח. טופו טעים."
	},
	{
		"date": "05-11-16",
		"time": " 20:31:04",
		"user": " דוד ירון",
		"content": " <‏התמונה הושמטה>"
	},
	{
		"date": "05-11-16",
		"time": " 20:31:22",
		"user": " דוד ירון",
		"content": " <‏התמונה הושמטה>"
	},
	{
		"date": "05-11-16",
		"time": " 20:31:38",
		"user": " דוד ירון",
		"content": " <‏התמונה הושמטה>"
	},
	{
		"date": "05-11-16",
		"time": " 20:46:36",
		"user": " Zalman",
		"content": " בתאבון!!"
	},
	{
		"date": "05-11-16",
		"time": " 20:58:49",
		"user": " Raya",
		"content": " 2016-05-11-VIDEO-00004551.mp4 <‏מצורף>"
	},
	{
		"date": "05-11-16",
		"time": " 22:32:54",
		"user": " דני ק",
		"content": " שימו השכמה ל 07:30. ארוחת בוקר נסגרת ב 08:30"
	},
	{
		"date": "05-12-16",
		"time": " 7:08:56",
		"user": " צביקה",
		"content": " לצביקה מזל טוב עד 120 עלה והצלח בכל אשר תפנה "
	},
	{
		"date": "05-12-16",
		"time": " 7:09:37",
		"user": " דוד ירון",
		"content": " מזל טוב������������������"
	},
	{
		"date": "05-12-16",
		"time": " 7:09:57",
		"user": " צביקה",
		"content": " רצת כבר"
	},
	{
		"date": "05-12-16",
		"time": " 7:11:47",
		"user": " דוד ירון",
		"content": " כן ב 5"
	},
	{
		"date": "05-12-16",
		"time": " 7:12:05",
		"user": " דוד ירון",
		"content": " אנחנו בחוץ רוצה קפה?"
	},
	{
		"date": "05-12-16",
		"time": " 7:12:28",
		"user": " צביקה",
		"content": " יפה. היה קר?פגשת בדואים ?"
	},
	{
		"date": "05-12-16",
		"time": " 7:13:12",
		"user": " דוד ירון",
		"content": " רק סביב הישוב 2 סיבובים"
	},
	{
		"date": "05-12-16",
		"time": " 7:29:11",
		"user": " אמא",
		"content": " גם אנחנו מצטרפים לברכות. יום הולדת שמח."
	},
	{
		"date": "05-12-16",
		"time": " 7:33:39",
		"user": " אלון דוד",
		"content": " מזל טוב צביקה הרבה בראות ואושר������������"
	},
	{
		"date": "05-12-16",
		"time": " 9:27:43",
		"user": " רותם קרויטורו",
		"content": " 2016-05-12-PHOTO-00004562.jpg <‏מצורף>"
	},
	{
		"date": "05-12-16",
		"time": " 9:27:44",
		"user": " רותם קרויטורו",
		"content": " 2016-05-12-PHOTO-00004563.jpg <‏מצורף>"
	},
	{
		"date": "05-12-16",
		"time": " 9:27:44",
		"user": " רותם קרויטורו",
		"content": " 2016-05-12-PHOTO-00004564.jpg <‏מצורף>"
	},
	{
		"date": "05-12-16",
		"time": " 9:52:32",
		"user": " שרית קרויטורו",
		"content": " צביקה היקר! "
	},
	{
		"date": "אוהבים- שרית ",
		"time": " כפיר",
		"user": " רותם וטום����������",
		"content": ""
	},
	{
		"date": "05-12-16",
		"time": " 10:02:50",
		"user": " אלון דוד",
		"content": " 2016-05-12-PHOTO-00004566.jpg <‏מצורף>"
	},
	{
		"date": "05-12-16",
		"time": " 10:02:53",
		"user": " אלון דוד",
		"content": " ��������������"
	},
	{
		"date": "05-12-16",
		"time": " 10:04:05",
		"user": " רותם קרויטורו",
		"content": " איזה טיול"
	},
	{
		"date": "05-12-16",
		"time": " 10:04:08",
		"user": " רותם קרויטורו",
		"content": " ?"
	},
	{
		"date": "05-12-16",
		"time": " 10:05:04",
		"user": " רותם קרויטורו",
		"content": " נו תענה איזה טיול?"
	},
	{
		"date": "05-12-16",
		"time": " 11:13:38",
		"user": " דוד ירון",
		"content": " <‏התמונה הושמטה>"
	},
	{
		"date": "05-12-16",
		"time": " 11:27:08",
		"user": " Raya",
		"content": " <‏התמונה הושמטה>"
	},
	{
		"date": "05-12-16",
		"time": " 12:51:02",
		"user": " פרידה",
		"content": " מתחילים ללכת לכוון החניה"
	},
	{
		"date": "05-12-16",
		"time": " 13:59:51",
		"user": " דני ק",
		"content": " 2016-05-12-PHOTO-00004574.jpg <‏מצורף>"
	},
	{
		"date": "05-12-16",
		"time": " 16:48:52",
		"user": " דני ק",
		"content": " 2016-05-12-PHOTO-00004575.jpg <‏מצורף>"
	},
	{
		"date": "05-12-16",
		"time": " 18:19:24",
		"user": " פרידה",
		"content": " 2016-05-12-PHOTO-00004576.jpg <‏מצורף>"
	},
	{
		"date": "05-12-16",
		"time": " 18:42:04",
		"user": " צביקה",
		"content": " 2016-05-12-PHOTO-00004577.jpg <‏מצורף>"
	},
	{
		"date": "05-12-16",
		"time": " 18:42:05",
		"user": " צביקה",
		"content": " 2016-05-12-PHOTO-00004578.jpg <‏מצורף>"
	},
	{
		"date": "05-12-16",
		"time": " 18:42:05",
		"user": " צביקה",
		"content": " 2016-05-12-PHOTO-00004579.jpg <‏מצורף>"
	},
	{
		"date": "05-12-16",
		"time": " 18:42:06",
		"user": " צביקה",
		"content": " 2016-05-12-PHOTO-00004580.jpg <‏מצורף>"
	},
	{
		"date": "05-12-16",
		"time": " 18:42:11",
		"user": " צביקה",
		"content": " 2016-05-12-PHOTO-00004581.jpg <‏מצורף>"
	},
	{
		"date": "05-12-16",
		"time": " 19:22:37",
		"user": " צביקה",
		"content": " 2016-05-12-PHOTO-00004582.jpg <‏מצורף>"
	},
	{
		"date": "05-12-16",
		"time": " 19:42:17",
		"user": " Raya",
		"content": " 2016-05-12-VIDEO-00004583.mp4 <‏מצורף>"
	},
	{
		"date": "05-12-16",
		"time": " 20:13:38",
		"user": " Raya",
		"content": " 2016-05-12-PHOTO-00004584.jpg <‏מצורף>"
	},
	{
		"date": "05-13-16",
		"time": " 7:55:24",
		"user": " דני ק",
		"content": " מישהו ער?"
	},
	{
		"date": "05-13-16",
		"time": " 7:58:10",
		"user": " פרידה",
		"content": " אנחנו"
	},
	{
		"date": "05-13-16",
		"time": " 8:08:05",
		"user": " צביקה",
		"content": " אנחנו בחוץ"
	},
	{
		"date": "05-13-16",
		"time": " 10:30:02",
		"user": " פרידה",
		"content": " מחכים בכניסה לקיבוץ"
	},
	{
		"date": "05-13-16",
		"time": " 12:03:48",
		"user": " אלון דוד",
		"content": " חחחחחחח"
	},
	{
		"date": "05-13-16",
		"time": " 12:03:51",
		"user": " אלון דוד",
		"content": " 2016-05-13-PHOTO-00004590.jpg <‏מצורף>"
	},
	{
		"date": "05-13-16",
		"time": " 12:07:48",
		"user": " אלון דוד",
		"content": " 2016-05-13-AUDIO-00004591.opus <‏מצורף>"
	},
	{
		"date": "05-13-16",
		"time": " 12:08:27",
		"user": " רותם קרויטורו",
		"content": " נעמה לא אוהבת פפרצי"
	},
	{
		"date": "05-13-16",
		"time": " 12:08:48",
		"user": " Ziv Hatichhhhh",
		"content": " 2016-05-13-PHOTO-00004593.jpg <‏מצורף>"
	},
	{
		"date": "05-13-16",
		"time": " 15:12:21",
		"user": " Raya",
		"content": " 2016-05-13-PHOTO-00004594.jpg <‏מצורף>"
	},
	{
		"date": "05-13-16",
		"time": " 15:12:33",
		"user": " פרידה",
		"content": " 2016-05-13-PHOTO-00004595.jpg <‏מצורף>"
	},
	{
		"date": "05-13-16",
		"time": " 15:13:55",
		"user": " Raya",
		"content": " 2016-05-13-PHOTO-00004596.jpg <‏מצורף>"
	},
	{
		"date": "05-13-16",
		"time": " 15:13:56",
		"user": " Raya",
		"content": " 2016-05-13-PHOTO-00004597.jpg <‏מצורף>"
	},
	{
		"date": "05-13-16",
		"time": " 15:13:57",
		"user": " Raya",
		"content": " 2016-05-13-PHOTO-00004598.jpg <‏מצורף>"
	},
	{
		"date": "05-13-16",
		"time": " 17:25:59",
		"user": " אלון דוד",
		"content": " <‏התמונה הושמטה>"
	},
	{
		"date": "05-13-16",
		"time": " 17:26:12",
		"user": " אלון דוד",
		"content": " חחחחחח זה זיו אוהב"
	},
	{
		"date": "05-13-16",
		"time": " 21:14:58",
		"user": " צביקה",
		"content": " 2016-05-13-PHOTO-00004601.jpg <‏מצורף>"
	},
	{
		"date": "05-13-16",
		"time": " 21:15:43",
		"user": " Sweet Hila Croitoru",
		"content": " הגעתם כבר?"
	},
	{
		"date": "05-14-16",
		"time": " 8:32:04",
		"user": " צביקה",
		"content": " בוקר אור. מה יש לאכול בחדר אוכל"
	},
	{
		"date": "05-14-16",
		"time": " 9:05:56",
		"user": " פרידה",
		"content": " אוכל מדהים היום..."
	},
	{
		"date": "05-14-16",
		"time": " 9:06:25",
		"user": " פרידה",
		"content": " כמו אתמול רק בלי הטוסטר כי שבת..."
	},
	{
		"date": "05-14-16",
		"time": " 9:06:26",
		"user": " צביקה",
		"content": " וחם..."
	},
	{
		"date": "05-14-16",
		"time": " 9:22:55",
		"user": " Sweet Hila Croitoru",
		"content": " ועם מאסטר שף"
	},
	{
		"date": "05-14-16",
		"time": " 9:22:59",
		"user": " Sweet Hila Croitoru",
		"content": " ��"
	},
	{
		"date": "05-14-16",
		"time": " 10:56:46",
		"user": " פרידה",
		"content": " 2016-05-14-PHOTO-00004609.jpg <‏מצורף>"
	},
	{
		"date": "05-14-16",
		"time": " 10:57:08",
		"user": " פרידה",
		"content": " 2016-05-14-PHOTO-00004610.jpg <‏מצורף>"
	},
	{
		"date": "05-14-16",
		"time": " 10:57:24",
		"user": " פרידה",
		"content": " 2016-05-14-PHOTO-00004611.jpg <‏מצורף>"
	},
	{
		"date": "05-14-16",
		"time": " 10:57:29",
		"user": " צביקה",
		"content": " חם?"
	},
	{
		"date": "05-14-16",
		"time": " 10:58:23",
		"user": " פרידה",
		"content": " אש"
	},
	{
		"date": "05-14-16",
		"time": " 10:58:38",
		"user": " צביקה",
		"content": " פה 36"
	},
	{
		"date": "05-14-16",
		"time": " 11:25:21",
		"user": " פרידה",
		"content": " 2016-05-14-PHOTO-00004615.jpg <‏מצורף>"
	},
	{
		"date": "05-14-16",
		"time": " 11:27:30",
		"user": " שרית קרויטורו",
		"content": " נראה מהנה��"
	},
	{
		"date": "05-14-16",
		"time": " 13:29:49",
		"user": " פרידה",
		"content": " 2016-05-14-PHOTO-00004617.jpg <‏מצורף>"
	},
	{
		"date": "05-14-16",
		"time": " 13:30:05",
		"user": " פרידה",
		"content": " 2016-05-14-PHOTO-00004618.jpg <‏מצורף>"
	},
	{
		"date": "05-14-16",
		"time": " 13:32:29",
		"user": " צביקה",
		"content": " נראה ריק"
	},
	{
		"date": "05-14-16",
		"time": " 13:34:01",
		"user": " פרידה",
		"content": " דווקא מלא יחסית לימים קודמים"
	},
	{
		"date": "05-14-16",
		"time": " 14:36:49",
		"user": " Raya",
		"content": " 2016-05-14-PHOTO-00004621.jpg <‏מצורף>"
	},
	{
		"date": "05-14-16",
		"time": " 14:50:14",
		"user": " פרידה",
		"content": " 2016-05-14-PHOTO-00004622.jpg <‏מצורף>"
	},
	{
		"date": "05-14-16",
		"time": " 14:59:21",
		"user": " Raya",
		"content": " ��"
	},
	{
		"date": "05-15-16",
		"time": " 19:01:12",
		"user": " דני ק",
		"content": " 2016-05-15-VIDEO-00004624.mp4 <‏מצורף>"
	},
	{
		"date": "05-15-16",
		"time": " 19:01:37",
		"user": " דני ק",
		"content": " 2016-05-15-PHOTO-00004625.jpg <‏מצורף>"
	},
	{
		"date": "05-16-16",
		"time": " 9:09:17",
		"user": " Raya",
		"content": " המון מזל טוב לאסתריקה ����������שפע של בריאות אושר שמחה ואהבה לרוב ����������"
	},
	{
		"date": "05-16-16",
		"time": " 9:24:23",
		"user": " דוד ירון",
		"content": " מזל טוב לאסתריקה "
	},
	{
		"date": "05-16-16",
		"time": " 10:40:20",
		"user": " פרידה",
		"content": " התחלת חגיגות יום ההולדת ��"
	},
	{
		"date": "05-16-16",
		"time": " 10:40:21",
		"user": " פרידה",
		"content": " 2016-05-16-PHOTO-00004629.jpg <‏מצורף>"
	},
	{
		"date": "05-16-16",
		"time": " 11:06:14",
		"user": " שרית קרויטורו",
		"content": " מזל-טוב!!! המון בריאות ואושר! שתמיד תהיי מוקפת באהבה❤������������������"
	},
	{
		"date": "05-16-16",
		"time": " 11:33:22",
		"user": " דני ק",
		"content": " המון בריאות"
	},
	{
		"date": "05-16-16",
		"time": " 11:35:45",
		"user": " פרידה",
		"content": " 2016-05-16-PHOTO-00004632.jpg <‏מצורף>"
	},
	{
		"date": "05-16-16",
		"time": " 11:39:08",
		"user": " Raya",
		"content": " מקסים ! פרידה מסכימה עם כל מילה"
	},
	{
		"date": "05-16-16",
		"time": " 11:41:25",
		"user": " פרידה",
		"content": " ירון כתב. וגם אני מסכימה עם כל מילה ��"
	},
	{
		"date": "05-16-16",
		"time": " 12:00:22",
		"user": " אלון דוד",
		"content": " מזל טוב"
	},
	{
		"date": "05-16-16",
		"time": " 12:00:29",
		"user": " אלון דוד",
		"content": " ������������"
	},
	{
		"date": "05-16-16",
		"time": " 12:26:13",
		"user": " דני ק",
		"content": " כל הכבוד ירון!"
	},
	{
		"date": "05-16-16",
		"time": " 16:52:52",
		"user": " פרידה",
		"content": " פעילויות מתקני המלון - מלון נוף גינוסר"
	},
	{
		"date": "05-18-16",
		"time": " 11:14:39",
		"user": " צביקה",
		"content": " הגן הולך להצגה "
	},
	{
		"date": "05-18-16",
		"time": " 11:27:40",
		"user": " פרידה",
		"content": " חמודים. אתה הורה מלווה?"
	},
	{
		"date": "05-18-16",
		"time": " 11:28:42",
		"user": " פרידה",
		"content": " המון בנות לעומת בנים. לא?!"
	},
	{
		"date": "05-18-16",
		"time": " 11:33:30",
		"user": " צביקה",
		"content": " לא "
	},
	{
		"date": "05-18-16",
		"time": " 13:12:50",
		"user": " פרידה",
		"content": " צימרים חוות כנרת צימרים בכנרת"
	},
	{
		"date": "05-18-16",
		"time": " 13:13:05",
		"user": " פרידה",
		"content": " מה דעתכם?"
	},
	{
		"date": "05-18-16",
		"time": " 13:30:23",
		"user": " פרידה",
		"content": " ביררתי במושבה כינרת. לינק למעלה. נשארו 3 חדרים אחרונים אבל לחמישי עד שבת 9-11/6. מקבלים חדרים בשלוש. מפנים בשבת בשתיים."
	},
	{
		"date": "05-18-16",
		"time": " 13:31:41",
		"user": " Raya",
		"content": " לא מתאים מחמישי"
	},
	{
		"date": "05-18-16",
		"time": " 13:38:02",
		"user": " פרידה",
		"content": " למה? אחרי בית ספר"
	},
	{
		"date": "05-18-16",
		"time": " 13:59:40",
		"user": " Raya",
		"content": " יום שישי אין לימודים ?"
	},
	{
		"date": "05-18-16",
		"time": " 14:00:26",
		"user": " פרידה",
		"content": " יש"
	},
	{
		"date": "05-18-16",
		"time": " 14:00:35",
		"user": " Raya",
		"content": " לא טוב לנו"
	},
	{
		"date": "05-18-16",
		"time": " 14:00:47",
		"user": " Raya",
		"content": " יום חמישי לזיו יש חוג"
	},
	{
		"date": "05-18-16",
		"time": " 14:56:05",
		"user": " צביקה",
		"content": " 2016-05-18-PHOTO-00004653.jpg <‏מצורף>"
	},
	{
		"date": "05-18-16",
		"time": " 14:59:16",
		"user": " פרידה",
		"content": " באיזה חוף? זמין ל 10-12/6?"
	},
	{
		"date": "05-18-16",
		"time": " 15:01:39",
		"user": " Raya",
		"content": " ����"
	},
	{
		"date": "05-18-16",
		"time": " 15:02:16",
		"user": " צביקה",
		"content": " לאיזה חוף שרוצים"
	},
	{
		"date": "05-18-16",
		"time": " 15:10:07",
		"user": " דוד ירון",
		"content": " לאילת"
	},
	{
		"date": "05-18-16",
		"time": " 15:10:49",
		"user": " דוד ירון",
		"content": " או עם הגיפ לעין עקב"
	},
	{
		"date": "05-18-16",
		"time": " 15:10:54",
		"user": " צביקה",
		"content": " 40Cֱֶׁׂׂ"
	},
	{
		"date": "05-18-16",
		"time": " 15:12:26",
		"user": " צביקה",
		"content": " ����☀����"
	},
	{
		"date": "05-18-16",
		"time": " 16:23:25",
		"user": " פרידה",
		"content": " רוצים בצפון. כינרת או סתם עם בריכה"
	},
	{
		"date": "05-18-16",
		"time": " 16:55:54",
		"user": " צביקה",
		"content": " http://www.ynet.co.il/articles/0"
	},
	{
		"date": "05-18-16",
		"time": " 17:06:47",
		"user": " Sweet Hila Croitoru",
		"content": " כנרת ובריכה"
	},
	{
		"date": "05-19-16",
		"time": " 12:37:13",
		"user": " צביקה",
		"content": " 2016-05-19-PHOTO-00004664.jpg <‏מצורף>"
	},
	{
		"date": "05-19-16",
		"time": " 12:41:32",
		"user": " פרידה",
		"content": " אולי ב 9/6 למרות שגם מאיר שלו מעניין אבל התאריך לא מתאים. עד מתי צריך להחליט?"
	},
	{
		"date": "05-19-16",
		"time": " 12:42:11",
		"user": " צביקה",
		"content": " לדעתי כמה שיותר מהר - המקום ממש קטן"
	},
	{
		"date": "05-19-16",
		"time": " 13:26:29",
		"user": " צביקה",
		"content": " https://goo.gl/photos/rf15nMRRdUqpsgi27"
	},
	{
		"date": "05-19-16",
		"time": " 13:33:38",
		"user": " צביקה",
		"content": " 2016-05-19-VIDEO-00004668.mp4 <‏מצורף>"
	},
	{
		"date": "05-19-16",
		"time": " 13:40:44",
		"user": " Raya",
		"content": " איזה יופי !"
	},
	{
		"date": "05-19-16",
		"time": " 13:53:08",
		"user": " Sweet Hila Croitoru",
		"content": " ����������������❤����������"
	},
	{
		"date": "05-19-16",
		"time": " 18:36:56",
		"user": " רותם קרויטורו",
		"content": " 2016-05-19-PHOTO-00004671.jpg <‏מצורף>"
	},
	{
		"date": "05-19-16",
		"time": " 18:37:49",
		"user": " שרית קרויטורו",
		"content": " מי זה !? טום??"
	},
	{
		"date": "05-19-16",
		"time": " 20:31:05",
		"user": " רותם קרויטורו",
		"content": " כן"
	},
	{
		"date": "05-19-16",
		"time": " 21:11:22",
		"user": " Zalman",
		"content": " 2016-05-19-PHOTO-00004674.jpg <‏מצורף>"
	},
	{
		"date": "05-20-16",
		"time": " 15:28:40",
		"user": " פרידה",
		"content": " 2016-05-20-PHOTO-00004675.jpg <‏מצורף>"
	},
	{
		"date": "05-20-16",
		"time": " 15:28:43",
		"user": " פרידה",
		"content": " 2016-05-20-PHOTO-00004676.jpg <‏מצורף>"
	},
	{
		"date": "05-20-16",
		"time": " 15:34:50",
		"user": " צביקה",
		"content": " <‏התמונה הושמטה>"
	},
	{
		"date": "05-20-16",
		"time": " 15:34:57",
		"user": " צביקה",
		"content": " <‏התמונה הושמטה>"
	},
	{
		"date": "05-20-16",
		"time": " 15:35:17",
		"user": " צביקה",
		"content": " 2016-05-20-PHOTO-00004679.jpg <‏מצורף>"
	},
	{
		"date": "05-20-16",
		"time": " 15:40:11",
		"user": " פרידה",
		"content": " 2016-05-20-PHOTO-00004680.jpg <‏מצורף>"
	},
	{
		"date": "05-20-16",
		"time": " 15:40:41",
		"user": " פרידה",
		"content": " 2016-05-20-PHOTO-00004681.jpg <‏מצורף>"
	},
	{
		"date": "05-20-16",
		"time": " 15:41:45",
		"user": " פרידה",
		"content": " 2016-05-20-PHOTO-00004682.jpg <‏מצורף>"
	},
	{
		"date": "05-20-16",
		"time": " 17:51:28",
		"user": " פרידה",
		"content": " 2016-05-20-PHOTO-00004683.jpg <‏מצורף>"
	},
	{
		"date": "05-21-16",
		"time": " 16:47:27",
		"user": " צביקה",
		"content": " 2016-05-21-PHOTO-00004684.jpg <‏מצורף>"
	},
	{
		"date": "05-21-16",
		"time": " 16:47:27",
		"user": " צביקה",
		"content": " 2016-05-21-PHOTO-00004685.jpg <‏מצורף>"
	},
	{
		"date": "05-21-16",
		"time": " 16:47:29",
		"user": " צביקה",
		"content": " 2016-05-21-PHOTO-00004686.jpg <‏מצורף>"
	},
	{
		"date": "05-23-16",
		"time": " 11:11:22",
		"user": " ‏הודעות שהינך שולח/ת לקבוצה זו כרגע מאובטחות בהצפנה מקצה-לקצה.",
		"content": ""
	},
	{
		"date": "05-23-16",
		"time": " 13:53:15",
		"user": " Sweet Hila Croitoru",
		"content": " התמונה הכי מדהימה שהייתה בווצאפ בהיסטוריה!!"
	},
	{
		"date": "05-24-16",
		"time": " 10:19:11",
		"user": " דני ק",
		"content": " 2016-05-24-PHOTO-00004690.jpg <‏מצורף>"
	},
	{
		"date": "05-26-16",
		"time": " 10:36:14",
		"user": " דני ק",
		"content": " 2016-05-26-PHOTO-00004691.jpg <‏מצורף>"
	},
	{
		"date": "05-26-16",
		"time": " 11:18:19",
		"user": " Sweet Hila Croitoru",
		"content": " 2016-05-26-PHOTO-00004692.jpg <‏מצורף>"
	},
	{
		"date": "05-26-16",
		"time": " 11:18:27",
		"user": " Sweet Hila Croitoru",
		"content": " מכינות פנקייקים"
	},
	{
		"date": "05-26-16",
		"time": " 11:18:44",
		"user": " צביקה",
		"content": " מי בבית?"
	},
	{
		"date": "05-26-16",
		"time": " 11:19:10",
		"user": " Sweet Hila Croitoru",
		"content": " אני"
	},
	{
		"date": "05-26-16",
		"time": " 12:04:45",
		"user": " צביקה",
		"content": " כל הכבוד"
	},
	{
		"date": "05-26-16",
		"time": " 12:28:21",
		"user": " Sweet Hila Croitoru",
		"content": " 2016-05-26-PHOTO-00004697.jpg <‏מצורף>"
	},
	{
		"date": "05-26-16",
		"time": " 12:31:45",
		"user": " Sweet Hila Croitoru",
		"content": " 2016-05-26-PHOTO-00004698.jpg <‏מצורף>"
	},
	{
		"date": "05-26-16",
		"time": " 12:36:44",
		"user": " Raya",
		"content": " אין אלייך אלופה ��������"
	},
	{
		"date": "05-26-16",
		"time": " 13:00:44",
		"user": " צביקה",
		"content": " זה מתכון מהספר?"
	},
	{
		"date": "05-26-16",
		"time": " 14:32:26",
		"user": " Sweet Hila Croitoru",
		"content": " מתכון שלי"
	},
	{
		"date": "05-26-16",
		"time": " 14:43:36",
		"user": " שרית קרויטורו",
		"content": " הילה כל הכבוד!����"
	},
	{
		"date": "05-26-16",
		"time": " 21:13:28",
		"user": " דני ק",
		"content": " 2016-05-26-VIDEO-00004703.mp4 <‏מצורף>"
	},
	{
		"date": "05-26-16",
		"time": " 21:29:36",
		"user": " צביקה",
		"content": " קנית כרטיסים?"
	},
	{
		"date": "05-26-16",
		"time": " 21:30:10",
		"user": " דני ק",
		"content": " 2016-05-26-PHOTO-00004705.jpg <‏מצורף>"
	},
	{
		"date": "05-26-16",
		"time": " 21:30:24",
		"user": " דני ק",
		"content": " גם לא לאוטובוס"
	},
	{
		"date": "05-26-16",
		"time": " 21:30:53",
		"user": " צביקה",
		"content": " מי איתך?"
	},
	{
		"date": "05-26-16",
		"time": " 21:34:27",
		"user": " דני ק",
		"content": " רעיה ונעמה"
	},
	{
		"date": "05-26-16",
		"time": " 21:34:58",
		"user": " צביקה",
		"content": " רעיה על אופניים"
	},
	{
		"date": "05-26-16",
		"time": " 21:35:28",
		"user": " דני ק",
		"content": " כולם ברגל. מהבית. 5 קמ לצד"
	},
	{
		"date": "05-26-16",
		"time": " 21:35:44",
		"user": " צביקה",
		"content": " יפה"
	},
	{
		"date": "05-31-16",
		"time": " 15:10:43",
		"user": " דני ק",
		"content": " 2016-05-31-PHOTO-00004712.jpg <‏מצורף>"
	},
	{
		"date": "06-01-16",
		"time": " 9:19:23",
		"user": " פרידה",
		"content": " רק 10 ₪ לשובר פתוח המקנה הנחה של $140 לחופשה משפחתית (זוג + 2 ילדים) באופיר טורס"
	},
	{
		"date": "06-02-16",
		"time": " 20:15:00",
		"user": " דני ק",
		"content": " 2016-06-02-PHOTO-00004714.jpg <‏מצורף>"
	},
	{
		"date": "06-02-16",
		"time": " 20:15:59",
		"user": " צביקה",
		"content": " 2016-06-02-PHOTO-00004715.jpg <‏מצורף>"
	},
	{
		"date": "06-02-16",
		"time": " 20:16:31",
		"user": " דני ק",
		"content": " איפה?  מתי?  למה?"
	},
	{
		"date": "06-02-16",
		"time": " 20:25:13",
		"user": " צביקה",
		"content": " גשר אריק לפני 10 שעות"
	},
	{
		"date": "06-04-16",
		"time": " 12:24:40",
		"user": " פרידה",
		"content": " 2016-06-04-PHOTO-00004718.jpg <‏מצורף>"
	},
	{
		"date": "06-04-16",
		"time": " 12:28:38",
		"user": " פרידה",
		"content": " 2016-06-04-PHOTO-00004719.jpg <‏מצורף>"
	},
	{
		"date": "06-04-16",
		"time": " 12:29:51",
		"user": " צביקה",
		"content": " בתאבון"
	},
	{
		"date": "06-04-16",
		"time": " 13:20:05",
		"user": " דני ק",
		"content": " יוצאים לכיוון חיפה"
	},
	{
		"date": "06-04-16",
		"time": " 13:26:22",
		"user": " צביקה",
		"content": " מתאדים לכיוון חיפה"
	},
	{
		"date": "06-04-16",
		"time": " 13:26:30",
		"user": " צביקה",
		"content": " אנחנו לא"
	},
	{
		"date": "06-04-16",
		"time": " 13:27:23",
		"user": " Zalman",
		"content": " מתעדים?"
	},
	{
		"date": "06-04-16",
		"time": " 13:28:01",
		"user": " צביקה",
		"content": " מתאדים מהחום"
	},
	{
		"date": "06-04-16",
		"time": " 13:28:31",
		"user": " Zalman",
		"content": " חה חה חה"
	},
	{
		"date": "06-04-16",
		"time": " 13:38:32",
		"user": " Raya",
		"content": " כרגע בחוץ 34 מעלות מזג אויר מעולה לנסיעה לצפון ⛄"
	},
	{
		"date": "06-06-16",
		"time": " 8:24:37",
		"user": " Raya",
		"content": " שרית וצביקה היקרים שפע של מזל טוב ליום הנישואין ה20 ��������כן ירבו ❤"
	},
	{
		"date": "06-06-16",
		"time": " 8:46:34",
		"user": " פרידה",
		"content": " מזל טוב שרית וצביקה �� אושר ועושר ובריאות ושפע ��"
	},
	{
		"date": "06-06-16",
		"time": " 9:12:06",
		"user": " שרית קרויטורו",
		"content": " תודה רבה����❤❤❤❤"
	},
	{
		"date": "06-06-16",
		"time": " 9:13:32",
		"user": " דוד ירון",
		"content": " מזל טוב����"
	},
	{
		"date": "06-06-16",
		"time": " 9:30:24",
		"user": " צביקה",
		"content": " מצטרף לתודה של שרית"
	},
	{
		"date": "06-06-16",
		"time": " 20:26:56",
		"user": " צביקה",
		"content": " 2016-06-06-PHOTO-00004733.jpg <‏מצורף>"
	},
	{
		"date": "06-06-16",
		"time": " 20:52:37",
		"user": " שרית קרויטורו",
		"content": " רותם מתנה מקסימה!! תודה❤❤❤"
	},
	{
		"date": "06-06-16",
		"time": " 20:53:19",
		"user": " Raya",
		"content": " מהמם !"
	},
	{
		"date": "06-06-16",
		"time": " 21:06:34",
		"user": " פרידה",
		"content": " איזה יופי רותם כל הכבוד"
	},
	{
		"date": "06-06-16",
		"time": " 21:07:00",
		"user": " צביקה",
		"content": " זה בתוספת מכתבי ברכה ציורים וקפה למיטה בבוקר"
	},
	{
		"date": "06-07-16",
		"time": " 11:42:13",
		"user": " Raya",
		"content": " 2016-06-07-PHOTO-00004738.jpg <‏מצורף>"
	},
	{
		"date": "06-07-16",
		"time": " 11:42:34",
		"user": " Raya",
		"content": " שרית להכין לך פתק כזה ?"
	},
	{
		"date": "06-07-16",
		"time": " 11:45:01",
		"user": " שרית קרויטורו",
		"content": " חחח.. מקסים! "
	},
	{
		"date": "06-08-16",
		"time": " 17:47:38",
		"user": " צביקה",
		"content": " מישהו מעוניין בלינה בטבע חמישי לשישי או שישי לשבת?"
	},
	{
		"date": "06-08-16",
		"time": " 17:48:21",
		"user": " פרידה",
		"content": " האם הטבע ממוזג ושירותים ומקלחת צמודים?"
	},
	{
		"date": "06-08-16",
		"time": " 17:52:36",
		"user": " צביקה",
		"content": " תקשיבי לשיר של בו למוגלי e Baer e"
	},
	{
		"date": "06-08-16",
		"time": " 17:53:15",
		"user": " פרידה",
		"content": " איפה הטבע הזה שלך?"
	},
	{
		"date": "06-08-16",
		"time": " 17:53:22",
		"user": " צביקה",
		"content": " ‫the bare necessities"
	},
	{
		"date": "06-08-16",
		"time": " 17:53:37",
		"user": " פרידה",
		"content": " Bear"
	},
	{
		"date": "06-08-16",
		"time": " 17:53:54",
		"user": " פרידה",
		"content": " אתה מנסה להעליב ��?"
	},
	{
		"date": "06-08-16",
		"time": " 17:55:55",
		"user": " צביקה",
		"content": " זה גוגל"
	},
	{
		"date": "06-08-16",
		"time": " 17:56:16",
		"user": " פרידה",
		"content": " צדקת. Bare"
	},
	{
		"date": "06-08-16",
		"time": " 17:56:38",
		"user": " פרידה",
		"content": " https://youtu.be/9ogQ0uge06o"
	},
	{
		"date": "06-08-16",
		"time": " 18:29:35",
		"user": " צביקה",
		"content": " 2016-06-08-PHOTO-00004751.jpg <‏מצורף>"
	},
	{
		"date": "06-08-16",
		"time": " 18:33:23",
		"user": " פרידה",
		"content": " איזה חתיך."
	},
	{
		"date": "06-08-16",
		"time": " 18:38:36",
		"user": " צביקה",
		"content": " היום הראשון של כפיר בעבודה"
	},
	{
		"date": "06-08-16",
		"time": " 18:38:56",
		"user": " צביקה",
		"content": " אלוף גלידת יוגורט"
	},
	{
		"date": "06-08-16",
		"time": " 18:40:16",
		"user": " פרידה",
		"content": " יופי. בהצלחה"
	},
	{
		"date": "06-08-16",
		"time": " 18:40:41",
		"user": " פרידה",
		"content": " שמור לנו מנה כפיר ��"
	},
	{
		"date": "06-08-16",
		"time": " 18:58:54",
		"user": " Raya",
		"content": " יאמי כיף לך"
	},
	{
		"date": "06-08-16",
		"time": " 20:57:23",
		"user": " Sweet Hila Croitoru",
		"content": " בהצלחה����"
	},
	{
		"date": "06-08-16",
		"time": " 21:13:41",
		"user": " שרית קרויטורו",
		"content": " שלום לכולם "
	},
	{
		"date": "06-09-16",
		"time": " 8:30:08",
		"user": " שרית קרויטורו",
		"content": " 2016-06-09-PHOTO-00004762.jpg <‏מצורף>"
	},
	{
		"date": "06-09-16",
		"time": " 8:30:09",
		"user": " שרית קרויטורו",
		"content": " 2016-06-09-PHOTO-00004763.jpg <‏מצורף>"
	},
	{
		"date": "06-09-16",
		"time": " 9:38:34",
		"user": " Raya",
		"content": " 2016-06-09-PHOTO-00004764.jpg <‏מצורף>"
	},
	{
		"date": "06-11-16",
		"time": " 9:59:55",
		"user": " צביקה",
		"content": " 2016-06-11-VIDEO-00004765.mp4 <‏מצורף>"
	},
	{
		"date": "06-14-16",
		"time": " 13:45:26",
		"user": " שרית קרויטורו",
		"content": " 2016-06-14-PHOTO-00004766.jpg <‏מצורף>"
	},
	{
		"date": "06-14-16",
		"time": " 13:45:32",
		"user": " שרית קרויטורו",
		"content": " מצויינת השבוע !!��"
	},
	{
		"date": "06-14-16",
		"time": " 13:45:54",
		"user": " פרידה",
		"content": " כל הכבוד רותם ��"
	},
	{
		"date": "06-14-16",
		"time": " 13:46:45",
		"user": " Raya",
		"content": " ������"
	},
	{
		"date": "06-14-16",
		"time": " 13:46:48",
		"user": " צביקה",
		"content": " איפה צולם?"
	},
	{
		"date": "06-14-16",
		"time": " 13:48:48",
		"user": " צביקה",
		"content": " רותם את תמיד NUMBER ONE��"
	},
	{
		"date": "06-14-16",
		"time": " 13:50:48",
		"user": " רותם קרויטורו",
		"content": " אתה לא מזה את הכניסה לבית שלנו"
	},
	{
		"date": "06-14-16",
		"time": " 13:51:17",
		"user": " צביקה",
		"content": " הייתי מהופנט מהמבט שלך"
	},
	{
		"date": "06-15-16",
		"time": " 13:10:31",
		"user": " צביקה",
		"content": " 2016-06-15-PHOTO-00004774.jpg <‏מצורף>"
	},
	{
		"date": "06-15-16",
		"time": " 13:10:48",
		"user": " פרידה",
		"content": " ��"
	},
	{
		"date": "06-15-16",
		"time": " 13:11:30",
		"user": " Raya",
		"content": " ����"
	},
	{
		"date": "06-15-16",
		"time": " 17:43:33",
		"user": " דני ק",
		"content": " אישה מחליטה להתעלל בבעלה ולכבות לו את הטלוויזיה (מרחוק"
	},
	{
		"date": "06-15-16",
		"time": " 17:43:50",
		"user": " דני ק",
		"content": " 2016-06-15-VIDEO-00004778.mp4 <‏מצורף>"
	},
	{
		"date": "06-15-16",
		"time": " 20:58:45",
		"user": " צביקה",
		"content": " KFC"
	},
	{
		"date": "06-16-16",
		"time": " 11:16:47",
		"user": " דני ק",
		"content": " שנלך?"
	},
	{
		"date": "06-16-16",
		"time": " 11:30:12",
		"user": " צביקה",
		"content": " אפשר להזמין"
	},
	{
		"date": "06-18-16",
		"time": " 9:29:31",
		"user": " רותם קרויטורו",
		"content": " 2016-06-18-PHOTO-00004782.jpg <‏מצורף>"
	},
	{
		"date": "06-18-16",
		"time": " 14:05:12",
		"user": " Raya",
		"content": " יוצאים לכיוון חיפה"
	},
	{
		"date": "06-18-16",
		"time": " 14:22:56",
		"user": " צביקה",
		"content": " נסיעה טובה. תעצרו לגלידה בסינמה סיטי"
	},
	{
		"date": "06-18-16",
		"time": " 14:23:39",
		"user": " דני ק",
		"content": " אתם לא מגיעים לחיפה ?"
	},
	{
		"date": "06-18-16",
		"time": " 14:59:18",
		"user": " צביקה",
		"content": " לא. מעבירים דברים."
	},
	{
		"date": "06-20-16",
		"time": " 9:06:07",
		"user": " צביקה",
		"content": " איך היה אתמול?"
	},
	{
		"date": "06-20-16",
		"time": " 9:06:14",
		"user": " צביקה",
		"content": " הקונצרט"
	},
	{
		"date": "06-20-16",
		"time": " 9:13:10",
		"user": " Raya",
		"content": " לא אנחנו צילמנו אז רואים את הילה קצת"
	},
	{
		"date": "06-20-16",
		"time": " 9:13:17",
		"user": " Raya",
		"content": " היה מהמם !!!!"
	},
	{
		"date": "06-20-16",
		"time": " 9:13:55",
		"user": " Raya",
		"content": " 2016-06-20-VIDEO-00004791.mp4 <‏מצורף>"
	},
	{
		"date": "06-20-16",
		"time": " 10:14:49",
		"user": " צביקה",
		"content": " מאוד יפה"
	},
	{
		"date": "06-20-16",
		"time": " 11:10:41",
		"user": " שרית קרויטורו",
		"content": " מקסים! כל הכבוד להילה!"
	},
	{
		"date": "06-20-16",
		"time": " 17:24:32",
		"user": " Raya",
		"content": " 2016-06-20-PHOTO-00004794.jpg <‏מצורף>"
	},
	{
		"date": "06-20-16",
		"time": " 17:24:34",
		"user": " Raya",
		"content": " 2016-06-20-PHOTO-00004795.jpg <‏מצורף>"
	},
	{
		"date": "06-20-16",
		"time": " 17:33:03",
		"user": " פרידה",
		"content": " כל הכבוד זיו!"
	},
	{
		"date": "06-20-16",
		"time": " 17:33:43",
		"user": " פרידה",
		"content": " מזל טוב כפיר וזיו לסיום שנת הלימודים. תהנו בחופשה ����"
	},
	{
		"date": "06-20-16",
		"time": " 17:40:46",
		"user": " צביקה",
		"content": " צריך חדר גדול לכל התעודות.  כל הכבוד"
	},
	{
		"date": "06-20-16",
		"time": " 17:40:55",
		"user": " צביקה",
		"content": " יצאתי"
	},
	{
		"date": "06-21-16",
		"time": " 7:28:37",
		"user": " שרית קרויטורו",
		"content": " זיו כל הכבוד!!!"
	},
	{
		"date": "06-22-16",
		"time": " 16:09:42",
		"user": " דני ק",
		"content": " 2016-06-22-PHOTO-00004801.jpg <‏מצורף>"
	},
	{
		"date": "06-22-16",
		"time": " 16:09:51",
		"user": " דני ק",
		"content": " פתרון לקיץ !!!"
	},
	{
		"date": "06-23-16",
		"time": " 17:35:46",
		"user": " פרידה",
		"content": " בשבת אנחנו הולכים לתערוכה של מיכל אחות של ירון בנווה צדק. מי מצטרף אלינו?"
	},
	{
		"date": "06-23-16",
		"time": " 18:38:10",
		"user": " Sweet Hila Croitoru",
		"content": " 2016-06-23-PHOTO-00004804.jpg <‏מצורף>"
	},
	{
		"date": "06-23-16",
		"time": " 18:38:19",
		"user": " Sweet Hila Croitoru",
		"content": " לכיתה שלי מחר..."
	},
	{
		"date": "06-23-16",
		"time": " 18:44:44",
		"user": " פרידה",
		"content": " נראה טוב. שמרי לנו כמה לשבת ��"
	},
	{
		"date": "06-23-16",
		"time": " 18:45:58",
		"user": " Sweet Hila Croitoru",
		"content": " יצא לנו רק שני מיותרים ואני ואבא אכלנו"
	},
	{
		"date": "06-23-16",
		"time": " 18:46:06",
		"user": " Sweet Hila Croitoru",
		"content": " וזה לא קנוי"
	},
	{
		"date": "06-23-16",
		"time": " 18:53:41",
		"user": " פרידה",
		"content": " את הכנת? נראה מדהים"
	},
	{
		"date": "06-23-16",
		"time": " 18:54:21",
		"user": " Sweet Hila Croitoru",
		"content": " אני ואמא"
	},
	{
		"date": "06-23-16",
		"time": " 18:55:19",
		"user": " פרידה",
		"content": " ����"
	},
	{
		"date": "06-23-16",
		"time": " 19:07:04",
		"user": " צביקה",
		"content": " מדהים"
	},
	{
		"date": "06-23-16",
		"time": " 19:14:38",
		"user": " דני ק",
		"content": " אנחנו בשבת עסוקים עד 13:00 אח״כ כולם מוזמנים אלינו לצהרים. תודיעו מי מגיע!"
	},
	{
		"date": "06-23-16",
		"time": " 19:17:33",
		"user": " פרידה",
		"content": " אנחנו נגיע ��"
	},
	{
		"date": "06-23-16",
		"time": " 19:22:02",
		"user": " Sweet Hila Croitoru",
		"content": " 2016-06-23-AUDIO-00004815.opus <‏מצורף>"
	},
	{
		"date": "06-23-16",
		"time": " 19:22:52",
		"user": " Sweet Hila Croitoru",
		"content": " בטעות...������"
	},
	{
		"date": "06-23-16",
		"time": " 20:11:07",
		"user": " צביקה",
		"content": " 2016-06-23-PHOTO-00004817.jpg <‏מצורף>"
	},
	{
		"date": "06-23-16",
		"time": " 20:11:44",
		"user": " צביקה",
		"content": " 2016-06-23-PHOTO-00004818.jpg <‏מצורף>"
	},
	{
		"date": "06-23-16",
		"time": " 20:12:05",
		"user": " Raya",
		"content": " ��"
	},
	{
		"date": "06-23-16",
		"time": " 20:12:17",
		"user": " Raya",
		"content": " איזה כיף !!!!"
	},
	{
		"date": "06-23-16",
		"time": " 20:12:22",
		"user": " אלון דוד",
		"content": " ��������������"
	},
	{
		"date": "06-23-16",
		"time": " 20:20:26",
		"user": " פרידה",
		"content": " תהנו בבית החדש. לילה טוב ושקט ��⭐"
	},
	{
		"date": "06-23-16",
		"time": " 20:42:57",
		"user": " רותם קרויטורו",
		"content": " לילה טוב"
	},
	{
		"date": "06-23-16",
		"time": " 20:50:11",
		"user": " ‫‏החלפת את הנושא אל ",
		"content": ""
	},
	{
		"date": "06-23-16",
		"time": " 22:09:21",
		"user": " Sweet Hila Croitoru",
		"content": " לילה טוב������⭐��"
	},
	{
		"date": "06-23-16",
		"time": " 22:10:34",
		"user": " ‫‏הנושא שונה ל-",
		"content": ""
	},
	{
		"date": "06-23-16",
		"time": " 22:11:11",
		"user": " ‫‏הנושא שונה ל-",
		"content": ""
	},
	{
		"date": "06-24-16",
		"time": " 10:14:28",
		"user": " פרידה",
		"content": " 2016-06-24-PHOTO-00004828.jpg <‏מצורף>"
	},
	{
		"date": "06-24-16",
		"time": " 10:14:58",
		"user": " דוד ירון",
		"content": " תשלחי לאמנון"
	},
	{
		"date": "06-24-16",
		"time": " 10:25:48",
		"user": " צביקה",
		"content": " פרידה תני לו יותר להיות ליד נשים הוא פורח...."
	},
	{
		"date": "06-24-16",
		"time": " 10:27:19",
		"user": " פרידה",
		"content": " רק ליד יפהפיות. ככה הוא רגיל מהבית ��"
	},
	{
		"date": "06-24-16",
		"time": " 10:33:52",
		"user": " דוד ירון",
		"content": " 2016-06-24-PHOTO-00004832.jpg <‏מצורף>"
	},
	{
		"date": "06-24-16",
		"time": " 10:41:08",
		"user": " דוד ירון",
		"content": " 2016-06-24-VIDEO-00004833.mp4 <‏מצורף>"
	},
	{
		"date": "06-24-16",
		"time": " 11:35:47",
		"user": " Raya",
		"content": " 2016-06-24-PHOTO-00004834.jpg <‏מצורף>"
	},
	{
		"date": "06-24-16",
		"time": " 11:53:31",
		"user": " פרידה",
		"content": " כל הכבוד הילה ��"
	},
	{
		"date": "06-24-16",
		"time": " 11:55:04",
		"user": " שרית קרויטורו",
		"content": " אלופה !��"
	},
	{
		"date": "06-24-16",
		"time": " 21:02:31",
		"user": " דני ק",
		"content": " 2016-06-24-PHOTO-00004837.jpg <‏מצורף>"
	},
	{
		"date": "06-25-16",
		"time": " 11:55:29",
		"user": " פרידה",
		"content": " 2016-06-25-PHOTO-00004838.jpg <‏מצורף>"
	},
	{
		"date": "06-26-16",
		"time": " 20:52:28",
		"user": " פרידה",
		"content": " 2016-06-26-PHOTO-00004839.jpg <‏מצורף>"
	},
	{
		"date": "06-26-16",
		"time": " 20:53:37",
		"user": " צביקה",
		"content": " כל הכבוד"
	},
	{
		"date": "06-26-16",
		"time": " 21:03:12",
		"user": " דני ק",
		"content": " יפה מאוד"
	},
	{
		"date": "06-26-16",
		"time": " 21:20:16",
		"user": " Raya",
		"content": " ������"
	},
	{
		"date": "06-26-16",
		"time": " 21:21:32",
		"user": " Sweet Hila Croitoru",
		"content": " כל הכבוד������������������������"
	},
	{
		"date": "06-26-16",
		"time": " 22:01:16",
		"user": " צביקה",
		"content": " עכשיו כבר הגזמת - לא חבל על הבריאות שלך?"
	},
	{
		"date": "06-26-16",
		"time": " 22:01:58",
		"user": " שרית קרויטורו",
		"content": " היינו חייבים"
	},
	{
		"date": "06-26-16",
		"time": " 22:02:09",
		"user": " שרית קרויטורו",
		"content": " חמש דק"
	},
	{
		"date": "06-28-16",
		"time": " 8:04:48",
		"user": " פרידה",
		"content": " רותם החמודה"
	},
	{
		"date": "06-28-16",
		"time": " 8:16:36",
		"user": " דוד ירון",
		"content": " מזל טוב לרותם החמודה"
	},
	{
		"date": "06-28-16",
		"time": " 8:42:31",
		"user": " Raya",
		"content": " שפע ברכות ואיחולים ��������לרותם המהממת ים של כיף ��והצלחה בכל ��������������"
	},
	{
		"date": "06-28-16",
		"time": " 8:56:19",
		"user": " דני ק",
		"content": " מצטרף לאיחולים עם המון אהבה. מזל טוב רותם !!"
	},
	{
		"date": "06-28-16",
		"time": " 8:56:43",
		"user": " דני ק",
		"content": " 2016-06-28-VIDEO-00004851.mp4 <‏מצורף>"
	},
	{
		"date": "06-28-16",
		"time": " 8:56:43",
		"user": " דני ק",
		"content": " מהומות בשוויץ בעקבות ההפסד ביורו"
	},
	{
		"date": "06-28-16",
		"time": " 13:08:31",
		"user": " רותם קרויטורו",
		"content": " תודה❤"
	},
	{
		"date": "06-28-16",
		"time": " 13:17:54",
		"user": " Zalman",
		"content": " לרותם הנכדה המתוקה שלנו מזל טוב ויום הולדת שמח שיהיה לך כיף חיים. חופש נעים. סבתא וסבא ��"
	},
	{
		"date": "06-28-16",
		"time": " 15:27:14",
		"user": " דני ק",
		"content": " 2016-06-28-VIDEO-00004855.mp4 <‏מצורף>"
	},
	{
		"date": "06-28-16",
		"time": " 15:27:29",
		"user": " דני ק",
		"content": " חופש נעים לחובבי החשבון"
	},
	{
		"date": "06-28-16",
		"time": " 15:30:56",
		"user": " צביקה",
		"content": " יום שישי הקרוב מוזמנים לארוחת ערב לחגוג יום הולדת לרותם"
	},
	{
		"date": "06-28-16",
		"time": " 15:35:18",
		"user": " פרידה",
		"content": " ��������������"
	},
	{
		"date": "06-29-16",
		"time": " 7:58:23",
		"user": " צביקה",
		"content": " לכפיר בהצלחה בלשכת גיוס"
	},
	{
		"date": "06-29-16",
		"time": " 7:58:54",
		"user": " דוד ירון",
		"content": " בהצלחה היום?"
	},
	{
		"date": "06-29-16",
		"time": " 7:59:36",
		"user": " צביקה",
		"content": " עכשיו"
	},
	{
		"date": "06-29-16",
		"time": " 7:59:51",
		"user": " דוד ירון",
		"content": " בהצלחה ודש"
	},
	{
		"date": "06-29-16",
		"time": " 8:00:52",
		"user": " דני ק",
		"content": " בהצלחה ! שפר הופעתך!"
	},
	{
		"date": "06-29-16",
		"time": " 8:08:24",
		"user": " פרידה",
		"content": " בהצלחה רבה"
	},
	{
		"date": "06-29-16",
		"time": " 10:06:35",
		"user": " אמא",
		"content": " לכפיר"
	},
	{
		"date": "06-29-16",
		"time": " 14:31:51",
		"user": " פרידה",
		"content": " הי כפיר"
	},
	{
		"date": "06-29-16",
		"time": " 14:39:43",
		"user": " כפיר קרויטורו",
		"content": " בסדר"
	},
	{
		"date": "06-29-16",
		"time": " 14:40:42",
		"user": " פרידה",
		"content": " היו מבחנים? שאלו לאן אתה רוצה להתגייס?"
	},
	{
		"date": "06-29-16",
		"time": " 14:49:42",
		"user": " כפיר קרויטורו",
		"content": " כן"
	},
	{
		"date": "06-29-16",
		"time": " 14:50:23",
		"user": " צביקה",
		"content": " סיימת?"
	},
	{
		"date": "06-30-16",
		"time": " 13:26:07",
		"user": " דני ק",
		"content": " 2016-06-30-VIDEO-00004871.mp4 <‏מצורף>"
	},
	{
		"date": "06-30-16",
		"time": " 14:31:48",
		"user": " פרידה",
		"content": " מזל טוב הילה"
	},
	{
		"date": "06-30-16",
		"time": " 14:32:43",
		"user": " Raya",
		"content": " גם נעמה וטום סיימו שנה ��"
	},
	{
		"date": "06-30-16",
		"time": " 14:33:28",
		"user": " פרידה",
		"content": " מזל טוב וחופשה נעימה לנעמה וטום ��"
	},
	{
		"date": "06-30-16",
		"time": " 14:34:29",
		"user": " צביקה",
		"content": " מה עם ההורים לא מגיע להם שהחופשה תהיה נעימה?"
	},
	{
		"date": "06-30-16",
		"time": " 14:35:31",
		"user": " פרידה",
		"content": " מגיע בהחלט. יגיע ב 1 בספטמבר ��"
	},
	{
		"date": "06-30-16",
		"time": " 14:36:00",
		"user": " דני ק",
		"content": " 2016-06-30-PHOTO-00004877.jpg <‏מצורף>"
	},
	{
		"date": "07-01-16",
		"time": " 15:14:16",
		"user": " צביקה",
		"content": " מתי מתכננים להגיע?"
	},
	{
		"date": "07-01-16",
		"time": " 15:18:15",
		"user": " צביקה",
		"content": " מי שיש לו מברשות ואו מגש צבע מוזמן להביא"
	},
	{
		"date": "07-01-16",
		"time": " 15:21:03",
		"user": " Raya",
		"content": " אנחנו בדרך לנתניה"
	},
	{
		"date": "07-01-16",
		"time": " 15:23:41",
		"user": " צביקה",
		"content": " ומתי תגיעו לכאן"
	},
	{
		"date": "07-01-16",
		"time": " 15:27:01",
		"user": " Raya",
		"content": " 6-7"
	},
	{
		"date": "07-01-16",
		"time": " 15:31:08",
		"user": " פרידה",
		"content": " אנחנו מתארגנים לצאת עם ההורים ב 4. להגיע בסביבות 5. מתאים?"
	},
	{
		"date": "07-01-16",
		"time": " 15:35:06",
		"user": " צביקה",
		"content": " כן"
	},
	{
		"date": "07-01-16",
		"time": " 15:35:16",
		"user": " צביקה",
		"content": " להביא ציוד צביעה"
	},
	{
		"date": "07-01-16",
		"time": " 15:37:20",
		"user": " פרידה",
		"content": " יש טושים ��"
	},
	{
		"date": "07-01-16",
		"time": " 15:37:27",
		"user": " פרידה",
		"content": " מה בתוכנית?"
	},
	{
		"date": "07-01-16",
		"time": " 15:40:15",
		"user": " צביקה",
		"content": " צביעת קירות לא צביעת דפים"
	},
	{
		"date": "07-01-16",
		"time": " 15:44:17",
		"user": " צביקה",
		"content": " רעיה 6-7 זה מאוחר. לא ישאר כלום."
	},
	{
		"date": "07-01-16",
		"time": " 15:59:45",
		"user": " Raya",
		"content": " מה ? כל הקודם זוכה ?"
	},
	{
		"date": "07-01-16",
		"time": " 16:03:24",
		"user": " צביקה",
		"content": " לא כל הקודם. כל הבא בזמן"
	},
	{
		"date": "07-03-16",
		"time": " 12:03:13",
		"user": " רותם קרויטורו",
		"content": " 2016-07-03-PHOTO-00004892.jpg <‏מצורף>"
	},
	{
		"date": "07-03-16",
		"time": " 12:49:47",
		"user": " צביקה",
		"content": " רותם כל הכבוד"
	},
	{
		"date": "07-03-16",
		"time": " 14:46:07",
		"user": " דני ק",
		"content": " 2016-07-03-VIDEO-00004894.mp4 <‏מצורף>"
	},
	{
		"date": "07-03-16",
		"time": " 16:01:02",
		"user": " Raya",
		"content": " https://www.google.com/search?q=%D7%A8%D7%A7%20%D7%91%D7%A9%D7%A8%20%D7%A8%D7%9E%D7%AA%20%D7%94%D7%97%D7%99%D7%99%D7%9C&ie=UTF-8&oe=UTF-8&hl=he&client=safari&gfe_rd=cr&ei=bbN4V_vrJ7HH8Aeh35-QDg&dlnr=1#dlnr=1&fpstate=lie&gfe_rd=cr"
	},
	{
		"date": "07-03-16",
		"time": " 16:04:22",
		"user": " צביקה",
		"content": " רעיה. מה לעשות עם המידע"
	},
	{
		"date": "07-03-16",
		"time": " 16:14:44",
		"user": " Raya",
		"content": " חוגגים יום הולדת להילה שבת 16-7 בשעה 14:00"
	},
	{
		"date": "07-03-16",
		"time": " 16:15:16",
		"user": " Raya",
		"content": " Save the day"
	},
	{
		"date": "07-04-16",
		"time": " 10:28:09",
		"user": " Ziv Hatichhhhh",
		"content": " https://www.facebook.com/srutonimIL/videos/1233465316664631/"
	},
	{
		"date": "07-04-16",
		"time": " 10:33:07",
		"user": " Raya",
		"content": " נפלא !!!"
	},
	{
		"date": "07-04-16",
		"time": " 10:33:58",
		"user": " דני ק",
		"content": " בכיתי... מרגש"
	},
	{
		"date": "07-04-16",
		"time": " 10:34:20",
		"user": " Raya",
		"content": " בהצלחה בבגרות"
	},
	{
		"date": "07-06-16",
		"time": " 16:15:43",
		"user": " דני ק",
		"content": " 2016-07-06-PHOTO-00004904.jpg <‏מצורף>"
	},
	{
		"date": "07-07-16",
		"time": " 21:57:16",
		"user": " דני ק",
		"content": " 2016-07-07-VIDEO-00004905.mp4 <‏מצורף>"
	},
	{
		"date": "07-09-16",
		"time": " 11:43:39",
		"user": " Raya",
		"content": " <‏התמונה הושמטה>"
	},
	{
		"date": "07-09-16",
		"time": " 11:44:13",
		"user": " פרידה",
		"content": " תהנו"
	},
	{
		"date": "07-09-16",
		"time": " 11:51:31",
		"user": " שרית קרויטורו",
		"content": " אנחנו בדרך.."
	},
	{
		"date": "07-09-16",
		"time": " 11:51:36",
		"user": " שרית קרויטורו",
		"content": " <‏התמונה הושמטה>"
	},
	{
		"date": "07-09-16",
		"time": " 12:10:21",
		"user": " דני ק",
		"content": " 2016-07-09-PHOTO-00004910.jpg <‏מצורף>"
	},
	{
		"date": "07-09-16",
		"time": " 12:11:05",
		"user": " דני ק",
		"content": " חוף חוקוק 6₪ לשעה"
	},
	{
		"date": "07-09-16",
		"time": " 12:11:27",
		"user": " דני ק",
		"content": " אנחנו ליד המציל מצד ימין או על מזרון ענק במים"
	},
	{
		"date": "07-09-16",
		"time": " 20:40:50",
		"user": " דני ק",
		"content": " אנחנו בבית.  שבוע טוב לכולם!!!"
	},
	{
		"date": "07-09-16",
		"time": " 20:41:52",
		"user": " אמא",
		"content": " שבוע טוב גם לכם"
	},
	{
		"date": "07-09-16",
		"time": " 21:00:09",
		"user": " צביקה",
		"content": " גם אנחנו בבית"
	},
	{
		"date": "07-09-16",
		"time": " 21:22:16",
		"user": " Ziv Hatichhhhh",
		"content": " 2016-07-09-PHOTO-00004916.jpg <‏מצורף>"
	},
	{
		"date": "07-11-16",
		"time": " 12:18:05",
		"user": " דוד ירון",
		"content": " 2016-07-11-PHOTO-00004917.jpg <‏מצורף>"
	},
	{
		"date": "07-11-16",
		"time": " 12:26:27",
		"user": " שרית קרויטורו",
		"content": " בתאבון! נראה טעים��������"
	},
	{
		"date": "07-11-16",
		"time": " 12:45:48",
		"user": " צביקה",
		"content": " מה ירון אוכל צ'יפס עם?..."
	},
	{
		"date": "07-11-16",
		"time": " 13:04:49",
		"user": " Raya",
		"content": " וואו איזה כיף בתאבון"
	},
	{
		"date": "07-11-16",
		"time": " 19:37:00",
		"user": " דני ק",
		"content": " 2016-07-11-PHOTO-00004921.jpg <‏מצורף>"
	},
	{
		"date": "07-11-16",
		"time": " 20:30:20",
		"user": " דוד ירון",
		"content": " 2016-07-11-PHOTO-00004922.jpg <‏מצורף>"
	},
	{
		"date": "07-11-16",
		"time": " 20:31:04",
		"user": " אלון דוד",
		"content": " המלון נמצא בשכונה לא טוב נגיד ושנכנסים זה יפה אז זה מוזר"
	},
	{
		"date": "07-11-16",
		"time": " 20:31:11",
		"user": " אלון דוד",
		"content": " וזה חדר מלאכים"
	},
	{
		"date": "07-11-16",
		"time": " 20:31:53",
		"user": " דוד ירון",
		"content": " 2016-07-11-PHOTO-00004925.jpg <‏מצורף>"
	},
	{
		"date": "07-12-16",
		"time": " 20:19:46",
		"user": " פרידה",
		"content": " 2016-07-12-PHOTO-00004926.jpg <‏מצורף>"
	},
	{
		"date": "07-12-16",
		"time": " 20:25:23",
		"user": " צביקה",
		"content": " מה עם קפה"
	},
	{
		"date": "07-12-16",
		"time": " 20:26:23",
		"user": " פרידה",
		"content": " אלון הכין לנו בחדר ☕"
	},
	{
		"date": "07-12-16",
		"time": " 20:26:46",
		"user": " צביקה",
		"content": " יפה. כדי שלא תרדמו"
	},
	{
		"date": "07-12-16",
		"time": " 21:43:42",
		"user": " דני ק",
		"content": " 2016-07-12-PHOTO-00004930.jpg <‏מצורף>"
	},
	{
		"date": "07-12-16",
		"time": " 22:11:57",
		"user": " דני ק",
		"content": " 2016-07-12-PHOTO-00004931.jpg <‏מצורף>"
	},
	{
		"date": "07-13-16",
		"time": " 9:56:55",
		"user": " כפיר קרויטורו",
		"content": " 2016-07-13-PHOTO-00004932.jpg <‏מצורף>"
	},
	{
		"date": "07-13-16",
		"time": " 9:58:46",
		"user": " Raya",
		"content": " איזה מרגש !!! בהצלחה !!!!"
	},
	{
		"date": "07-13-16",
		"time": " 10:01:25",
		"user": " דני ק",
		"content": " מגניב. חצי שנה חופש...."
	},
	{
		"date": "07-13-16",
		"time": " 10:27:18",
		"user": " פרידה",
		"content": " מרגש מאוד... הרבה הצלחה!!!"
	},
	{
		"date": "07-13-16",
		"time": " 10:28:11",
		"user": " כפיר קרויטורו",
		"content": " לא עדיין לא קיבלתי מיונים"
	},
	{
		"date": "07-13-16",
		"time": " 10:33:50",
		"user": " פרידה",
		"content": " תצליח ותהנה. ותשמור על עצמך ועלינו. סומכים עליך ��"
	},
	{
		"date": "07-13-16",
		"time": " 10:39:12",
		"user": " צביקה",
		"content": " כולם להרגע יש עוד הרבה זמן עד 2018"
	},
	{
		"date": "07-13-16",
		"time": " 12:53:19",
		"user": " אמא",
		"content": " אנחנו בבית. איזה כייף!!!"
	},
	{
		"date": "07-13-16",
		"time": " 12:56:28",
		"user": " צביקה",
		"content": " יופי"
	},
	{
		"date": "07-13-16",
		"time": " 12:56:49",
		"user": " פרידה",
		"content": " 2016-07-13-PHOTO-00004941.jpg <‏מצורף>"
	},
	{
		"date": "07-13-16",
		"time": " 12:57:43",
		"user": " שרית קרויטורו",
		"content": " יופי! בשעה טובה!"
	},
	{
		"date": "07-13-16",
		"time": " 12:58:31",
		"user": " צביקה",
		"content": " מדהים"
	},
	{
		"date": "07-13-16",
		"time": " 13:10:56",
		"user": " Raya",
		"content": " יפה מאד"
	},
	{
		"date": "07-13-16",
		"time": " 14:50:38",
		"user": " פרידה",
		"content": " 2016-07-13-PHOTO-00004945.jpg <‏מצורף>"
	},
	{
		"date": "07-13-16",
		"time": " 15:14:54",
		"user": " Raya",
		"content": " נראה מושלם ��"
	},
	{
		"date": "07-13-16",
		"time": " 15:15:34",
		"user": " צביקה",
		"content": " מגניב"
	},
	{
		"date": "07-13-16",
		"time": " 18:41:23",
		"user": " פרידה",
		"content": " 2016-07-13-PHOTO-00004948.jpg <‏מצורף>"
	},
	{
		"date": "07-14-16",
		"time": " 8:44:57",
		"user": " צביקה",
		"content": " כפיר תפס אחד וגם אני אחד. Go Pokémon"
	},
	{
		"date": "07-14-16",
		"time": " 8:45:40",
		"user": " אמא",
		"content": " כל הכבוד. קשה?"
	},
	{
		"date": "07-14-16",
		"time": " 8:46:28",
		"user": " צביקה",
		"content": " קצת. היה אחד במטבח"
	},
	{
		"date": "07-14-16",
		"time": " 8:47:15",
		"user": " Sweet Hila Croitoru",
		"content": " 2016-07-14-PHOTO-00004952.jpg <‏מצורף>"
	},
	{
		"date": "07-15-16",
		"time": " 15:07:41",
		"user": " Raya",
		"content": " 2016-07-15-PHOTO-00004953.jpg <‏מצורף>"
	},
	{
		"date": "07-15-16",
		"time": " 15:11:01",
		"user": " צביקה",
		"content": " מגניב."
	},
	{
		"date": "07-15-16",
		"time": " 20:47:25",
		"user": " פרידה",
		"content": " 2016-07-15-PHOTO-00004955.jpg <‏מצורף>"
	},
	{
		"date": "07-15-16",
		"time": " 20:54:12",
		"user": " פרידה",
		"content": " <‏התמונה הושמטה>"
	},
	{
		"date": "07-16-16",
		"time": " 10:13:09",
		"user": " Raya",
		"content": " https://m.facebook.com/shuktzafon/"
	},
	{
		"date": "07-16-16",
		"time": " 10:14:10",
		"user": " Raya",
		"content": " ליד המסעדה שנהיה בה יש שוק צפון והיום יש מגלשות מים כדאי להביא בגדי ים"
	},
	{
		"date": "07-16-16",
		"time": " 10:19:43",
		"user": " אלון דוד",
		"content": " מזל טוב להילה��������"
	},
	{
		"date": "07-16-16",
		"time": " 10:22:29",
		"user": " פרידה",
		"content": " הילה החמודה"
	},
	{
		"date": "07-16-16",
		"time": " 10:53:31",
		"user": " צביקה",
		"content": " מתי הולכים למים לפני או אחרי"
	},
	{
		"date": "07-16-16",
		"time": " 10:57:59",
		"user": " דני ק",
		"content": " נלך אחרי"
	},
	{
		"date": "07-16-16",
		"time": " 11:11:22",
		"user": " Sweet Hila Croitoru",
		"content": " 2016-07-16-PHOTO-00004963.jpg <‏מצורף>"
	},
	{
		"date": "07-16-16",
		"time": " 11:11:23",
		"user": " צביקה",
		"content": " ישאר מספיק זמן?  זה רק עד 5 פתוח היום"
	},
	{
		"date": "07-16-16",
		"time": " 11:11:26",
		"user": " Sweet Hila Croitoru",
		"content": " ארוחת בוקר עם חברה"
	},
	{
		"date": "07-16-16",
		"time": " 11:23:53",
		"user": " שרית קרויטורו",
		"content": " הילה! מזל-טוב!! עד 120 שנה! מו ייתן וייתגשמו כל משאלות ליבך!����"
	},
	{
		"date": "07-16-16",
		"time": " 11:26:06",
		"user": " Raya",
		"content": " יפה הילה החגיגות החלו ������"
	},
	{
		"date": "07-16-16",
		"time": " 11:32:05",
		"user": " רותם קרויטורו",
		"content": " 2016-07-16-AUDIO-00004968.opus <‏מצורף>"
	},
	{
		"date": "07-16-16",
		"time": " 14:37:40",
		"user": " דני ק",
		"content": " 2016-07-16-PHOTO-00004969.jpg <‏מצורף>"
	},
	{
		"date": "07-18-16",
		"time": " 18:51:50",
		"user": " פרידה",
		"content": " 2016-07-18-PHOTO-00004970.jpg <‏מצורף>"
	},
	{
		"date": "07-18-16",
		"time": " 18:53:39",
		"user": " Sweet Hila Croitoru",
		"content": " מהממם����"
	},
	{
		"date": "07-18-16",
		"time": " 18:59:38",
		"user": " אלון דוד",
		"content": " 2016-07-18-PHOTO-00004972.jpg <‏מצורף>"
	},
	{
		"date": "07-18-16",
		"time": " 19:06:20",
		"user": " פרידה",
		"content": " 2016-07-18-PHOTO-00004973.jpg <‏מצורף>"
	},
	{
		"date": "07-18-16",
		"time": " 19:25:38",
		"user": " צביקה",
		"content": " מדהים"
	},
	{
		"date": "07-18-16",
		"time": " 20:17:58",
		"user": " Raya",
		"content": " איזה נופים מדהים ממש"
	},
	{
		"date": "07-19-16",
		"time": " 8:45:45",
		"user": " דני ק",
		"content": " 2016-07-19-PHOTO-00004976.jpg <‏מצורף>"
	},
	{
		"date": "07-19-16",
		"time": " 9:23:58",
		"user": " Sweet Hila Croitoru",
		"content": " ������"
	},
	{
		"date": "07-19-16",
		"time": " 12:36:21",
		"user": " דני ק",
		"content": " 2016-07-19-PHOTO-00004978.jpg <‏מצורף>"
	},
	{
		"date": "07-19-16",
		"time": " 12:44:10",
		"user": " פרידה",
		"content": " 2016-07-19-PHOTO-00004979.jpg <‏מצורף>"
	},
	{
		"date": "07-19-16",
		"time": " 12:45:24",
		"user": " פרידה",
		"content": " 2016-07-19-PHOTO-00004980.jpg <‏מצורף>"
	},
	{
		"date": "07-19-16",
		"time": " 12:47:37",
		"user": " שרית קרויטורו",
		"content": " נראה מקסים!"
	},
	{
		"date": "07-19-16",
		"time": " 12:51:38",
		"user": " אלון דוד",
		"content": " בגובה מעל 3000 מטר !!!"
	},
	{
		"date": "07-19-16",
		"time": " 12:52:09",
		"user": " דני ק",
		"content": " מה הטמפ׳?"
	},
	{
		"date": "07-19-16",
		"time": " 12:52:34",
		"user": " פרידה",
		"content": " 22 מעלות. תענוג"
	},
	{
		"date": "07-19-16",
		"time": " 12:52:41",
		"user": " פרידה",
		"content": " קרוב לשמש ��"
	},
	{
		"date": "07-19-16",
		"time": " 12:54:34",
		"user": " דני ק",
		"content": " מגניב.  תהנו."
	},
	{
		"date": "07-19-16",
		"time": " 12:56:56",
		"user": " Raya",
		"content": " על גג העולם ��"
	},
	{
		"date": "07-19-16",
		"time": " 12:57:39",
		"user": " Raya",
		"content": " איזה יופי"
	},
	{
		"date": "07-19-16",
		"time": " 13:30:23",
		"user": " פרידה",
		"content": " 2016-07-19-PHOTO-00004989.jpg <‏מצורף>"
	},
	{
		"date": "07-19-16",
		"time": " 13:30:46",
		"user": " פרידה",
		"content": " 2016-07-19-PHOTO-00004990.jpg <‏מצורף>"
	},
	{
		"date": "07-19-16",
		"time": " 13:33:38",
		"user": " צביקה",
		"content": " למה את נוסעת בזיגזגים"
	},
	{
		"date": "07-19-16",
		"time": " 13:34:30",
		"user": " אלון דוד",
		"content": " אין דרך אחרת"
	},
	{
		"date": "07-19-16",
		"time": " 13:37:35",
		"user": " צביקה",
		"content": " מה זה לכולם יש ווי פיי"
	},
	{
		"date": "07-19-16",
		"time": " 13:38:10",
		"user": " צביקה",
		"content": " אלון אנחנו שולחים את רותם עליכם . כדאי...?"
	},
{
  "date": "07-19-16",
  "time": " 13:42:27",
  "user": " אלון דוד",
  "content": " סבבה"
}
]
